{
  "upload_id": "hedron-sync-example-cube-abc123-deck-uuid",
  "cube_id": "example-cube",
  "pilot_name": "Seat3",
  "submitted_at": "2026-01-15T12:00:00.000Z",
  "schema_version": 1,
  "image_url": "https://cdn.example.com/decks/temp/redacted-deck-image.jpg",
  "image_source": "hedron",
  "match_wins": 2,
  "match_losses": 1,
  "match_draws": 0
}
